titles,category
안철수  이재명은  검은 코끼리    민주당 아무 일 못해 ,Politics
   국조 대상에 대검 빼달라  요구에 국조특위 첫 회의 파행,Politics
안철수  이재명  대한민국 근본 흔들고 훼손 스스로 대표직 내려놔야 ,Politics
태영호  김여정 막말 담화로  국민 이간질 넘어가면 안돼 ,Politics
황교익도  청담동 가짜뉴스  더탐사 직격  변명 여지 없어  거짓말  사과해야 ,Politics
 대통령  전투기 공장서  방산수출전략회의   미래 중추 ,Politics
황교익   청담동 술자리 의혹  보도 매체  거짓 중계 사과해야 ,Politics
암호화폐 등 독자 제재 논의에    격한  반응  왜 ,Politics
김여정  천치바보 정권  막말 공세 정부  개탄  강한 유감 ,Politics
    이재명 수사 공식화 에  민주당 뒤 숨지 말고 협조  압박,Politics
조응천  이재명  정치적 책임에 유감 표명해야 사실관계에 당 직접 대응  불편 ,Politics
최연혜 가스  사장 내정에    낙하산     공사 적자해결 ,Politics
유인태     멘토 조언에도  이재명 싫다 며 안 만나 ,Politics
김기현 공부모임에  나경원 강연하고  안철수도 참석,Politics
윤석열 대통령 문제적 발언부터 해명까지    시간  전말은,Politics
   국조 특위 첫날부터 이상민 사퇴 압박  상습 거짓말  종합 ,Politics
 술자리 의혹  김의겸  윤 대통령 등에 유감       사퇴해야 ,Politics
이재명 사법리스크   김의겸 가짜뉴스   노웅래 수뢰의혹 수렁에 빠진   ,Politics
 아니면 말고  김의겸  당 안팎서 책임론 확산,Politics
  이번 주에만 담화 세 번      후  추가 대응   무엇을 준비하나,Politics
김의겸  청담동  유감이나 다시 돌아가도 질문할 것 ,Politics
    맏형 진  크리스마스 앞두고 최전방 신병교육대로 입대,Politics
   대검 빼달라     합의된 사항  이태원 국조 특위 돌연 연기,Politics
나경원 안철수 불러모은 김기현 공부모임   친윤 모임도 다시 뜬다,Politics
여야  방송법 전쟁  돌입     언론장악 막아야      악법 중 악법 ,Politics
비명계  민주당의 이재명 방어에  제 의 조국사태  우려,Politics
전   현정권 비교하며  남남갈등 조장   김여정   천치바보  들먹이며  저급한 막말 ,Politics
미국   토마호크    발  핵잠수함 일본 오키나와 기항 이례적 공개,Politics
화물연대 파업 직격한 정진석  민주노총  국가물류 볼모로 정권퇴진 운동 ,Politics
  양금희  대장동 형제들 잇단 폭로   이재명 빠져나갈 확률    ,Politics
 약자 복지  공공임대주택 예산 국토위 통과    국힘 전원 불출석,Politics
 뉴스포커스  김여정  윤대통령 실명 막말  서울 과녁 까지 언급,Politics
김의겸    등 관련된 분들께 심심한 유감   청담동 술자리 의혹  사과,Politics
김여정   대통령 막말 비난  천치바보를 왜 보고만 있나  종합 보 ,Politics
       틀린 자막 씌워     웃프다  웃긴데 되게 슬픈거 ,Politics
청담동  가짜뉴스  드러나도 김의겸  그날 돌아가도 똑같이 물을것 ,Politics
올해의  탑 헬리건  김용진 대위  최정예 되도록 최선 ,Politics
통일부  김여정  막말  담화에  도적이 매를 드는 식 매우 개탄 ,Politics
첼리스트  거짓말  진술에   김기현   김의겸 의원직 사퇴해야 ,Politics
청담동 술자리 헛발질 김의겸  돌아가도 같은 질문할 것 ,Politics
신원식  김여정 막말  스스로 천박성 전 세계에 광고 ,Politics
 김기현 새미래 에 국민의힘 당권주자 집결 나경원  모두 하나 돼야 ,Politics
     술자리 의혹 거짓으로 드러나  김의겸 사퇴해야 ,Politics
 속보  김의겸  청담동 술자리  가짜뉴스  논란에  다시 그날로 되돌아간다 해도  ,Politics
김의겸  청담동 술자리  거짓말  진술에도  돌아가도 같은 질문     에 유감,Politics
김의겸   술자리 거짓말  진술에도  그날로 돌아가도 같은 질문할 것 ,Politics
나경원   고딩엄마   슈퍼맨    저출산 극복에 좋은 프로그램 ,Politics
 풍계리  번 갱도  여전히 작업중    핵잠수함     로 압박,Politics
유가족   대통령에게 행정부 수반으로서 진심어린 사과 원해 ,Politics
김의겸   술자리 제보자 거짓말 진술 에   에 심심한 유감 ,Politics
  대통령 등 관련된 분들께 심심한 유감  김의겸  청담동술자리 의혹 사과,Politics
 예산  조 줄고   예산  조 늘고     조 감세도  뇌관      조 예산전쟁 ,Politics
 단독  술자리 물증 안냈다  첼리스트  남친 공익신고 안될듯,Politics
성일종   패륜예산  이재명에   대표가  패륜 이란 말 쓰면 안돼 ,Politics
국방부  김여정  막말  담화에  동의할 사람 아무도 없어 ,Politics
역대 민선 제주지사 선거법과 악연 줄줄이 법정에 서,Politics
툭하면 보류 밀실로 넘어가는 예산심사,Politics
 속보 통일부  김여정에  도적이 매를 드는 식   국가원수에 저급한 막말 개탄 ,Politics
남남갈등 반정부투쟁 선동 김여정    천치바보  막말,Politics
김종민  당 차원에서 이재명 보호하면  제  조국사태  온다 ,Politics
김여정    저 천치바보  통일부  저급한 막말  매우 개탄 ,Politics
   한동훈 청담 술자리 는 거짓말  김의겸  심심한 유감     의원직 사퇴를 ,Politics
북한  가상화폐 탈취해 미사일 개발 마르지 않는 돈줄로 거침없이 도발,Politics
김기현 모임에   명 성황   연사  나경원  정권교체 완성은 총선 ,Politics
김의겸  청담동 술자리 제보자  거짓말  경찰 진술 사실이라면    등에 심심한 유감 ,Politics
   첼리스트  남친 속이려 거짓말    김의겸  대국민사과 사퇴 해임 촉구 ,Politics
민주   인사  줄수사  맹비난 일각서  단결 대응 불편  지적도,Politics
연평도 포격전   주년   대통령 메시지 안 냈다,Politics
국힘의 반격  의원직 사퇴하라     김의겸  심심한 유감 ,Politics
청계광장에 가면   운전기사 없는 자율주행버스 탄다,Politics
김기현 나경원 안철수 당권주자 한자리에  여당 힘 모을때 ,Politics
   세면 돌아가실 나이  국힘 인천시의원 망언 폭탄,Politics
조응천  민주당이 직접  정진상 김용 관련  대응하는 것 굉장히 불편 ,Politics
유인태  이재명 태도에  의원들 불만 유동규 중용 사과해야 ,Politics
 화생방부대  더블 드래건  한국 순환배치   동맹 지원 ,Politics
김재원이 바라본  김건희 사진 조명 의혹 의 진짜 의도는 ,Politics
첼리스트    동거인 속이려 거짓말   가짜뉴스 논란  더탐사   룸바게이트  영상 버젓이,Politics
박진  빈 살만과 부산엑스포 빅딜 설 에  사실 아냐 ,Politics
나경원  동거 미혼모 아이도 차별 안 받고 태어나게 해야 ,Politics
     미사일방어팀 부국장  북  정상각도로      시험발사할 것 ,Politics
비명계     방탄정당  프레임 씌우는 중  조국 사태 되풀이 말아야 ,Politics
 비명  조응천  이재명 또 압박  최측근 구속에 유감 표명해야       도 했다 ,Politics
강북구의원  서울신문 향해  정상적 언론인들 얼굴에 먹칠 그만하라 ,Politics
 년전  주호영 배은망덕 이라던    국조합의  주호영 중후한 경륜 덕  찬사,Politics
이재명 자택  억대 현금  출처 의혹에   민주  검찰    명예훼손 위한 악의적 주장 ,Politics
 이태원 참사  보고서 삭제 의혹   서울청 정보부장 소환,Politics
 영공방위  최고방공무기통제사  골든아이  김상훈 천호정 준위,Politics
김여정    천치바보  막말    도 넘은 남남갈등 반정부투쟁 선동 종합 ,Politics
 청담동 술자리 의혹  첼리스트  전 남친 속이려고 거짓말 ,Politics
이인제  화물연대 총파업 맹폭  대명천지에 일개 노조가 감히 국민에 도전한다면  ,Politics
윤핵관은 없었다 흔들리는 주호영 리더십,Politics
김기현 공부모임에   당권주자 총출동 나경원  모두가 하나 돼야 ,Politics
유인태   대통령  이재명 싫어서 만남 피한다고 들어 ,Politics
김여정  윤 겨냥  바보천치 보고만 있나  반정부 선동,Politics
    청담동 술자리  거짓말로 드러나 김의겸  의원직 사퇴해야 ,Politics
거세지는 비명계 압박  이재명 유감 표명하라   제 의 조국사태 올 수도 ,Politics
조응천  이재명  노무현 전 대통령처럼 유감 표명해야 ,Politics
 자식 눈물은 자기가 닦게 해야  오영석 박사 별세,Politics
유인태  유동규 등용한 사람 누구냐 이재명 사과해야 ,Politics
  김여정  정부  독자제재 검토 에  서울 직접 타격  위협 맹비난,Politics
정진석  화물연대 총파업  사실상  정권 퇴진  운동 ,Politics
윤 대통령 집무실 문 전 대통령 사저      내 집회금지법 소위 통과,Politics
유인태  이재명 태도에 의원들 불만  유동규 등용 사과해야 ,Politics
 김종민  민주당  이재명 방탄때는 조국사태 재연  경고,Politics
유인태     멘토 조언에도  이재명 싫다 면서 안 만나 ,Politics
친문 김종민    목표  민주당 방탄정당으로 만드는 것 ,Politics
 서울 과녁  위협에    천치바보  막말 김여정 발끈한 배경,Politics
나경원  정권교체 완성은 총선 승리  한자리 모인   당권 주자들 종합 ,Politics
 한동훈 선대위  구도로 민주당 심판 총선 만드나,Politics
 핵잠수함   도발 잇따랐던 이달 초  근해서 작전 수행,Politics
김여정  독자 대북제재 맹비난 윤 대통령 향해 막말,Politics
 최강시사  이소영  검찰  차라리 이재명 빨리 소환 조사하라     정미경  이재명  검찰 소환에 안 응할 것 ,Politics
 뉴스킹  서영교  국조 범위  경호처 법무부  제외에  재협상 통해 포함시켜야 ,Politics
 김혜경 비서  이재명 자택서 억대 현금 들고나와 ,Politics
   한동훈 청담동 술자리  없었다 첼리스트  남친 속이려 거짓말 ,Politics
   화물연대 총파업에  사실상 정권퇴진 운동 즉각 접어야 ,Politics
김여정  또   실명비판 핵무력완성 선언  주년     중대 도발 하나,Politics
야당  패륜예산  비판에 성일종   대표가 패륜이란 말 쓰면 안돼 ,Politics
       부국장      정상각도 로      시험발사할 가능성 높아 ,Politics
 친절한 대기자 경찰  이상민 장관 수사 제대로 할 수 있을까 ,Politics
조응천     안희정 구속때 절절히 유감 표명 이재명도 해라 ,Politics
김기현  술자리 거짓말 흑석거사 김의겸 사퇴해야 ,Politics
유인태      이재명 만나라  원로 조언에  인간 자체가 싫다 고 ,Politics
 당내 그런 움직임 없다  이재명 조기퇴진 가능성 일축한 조응천,Politics
   반정부 투쟁 선동까지  김여정 막말 에 담긴 뜻은,Politics
미 핵추진 잠수함 위치 이례적 공개  북에 경고장,Politics
 청담동 술자리  결국 거짓말   의혹 제기 김의겸 측 답변은 ,Politics
조응천  김용 정진상 당직 사의에  편법으로 해소한 것 ,Politics
유인태  유동규 중용한 사람 누구냐 이재명 사과해야 ,Politics
조경태       축구 국가대항전서  우리 선수 반칙  까발린 셈 ,Politics
 뉴스킹     시간 업무에 월    만 원    화물연대가 두 번째 총파업에 나선 이유,Politics
육군      내년부터 도태  대체전력이 없다,Politics
 토마호크    발   오하이오급 핵잠수함  오키나와 기항 공개,Politics
조응천  이재명  억 천 현금보유  구린 돈 아닐 것  수사 봐야 ,Politics
금태섭    죽창가   은 쓰레빠 사소한 것에 목숨 ,Politics
유인태     멘토 조언에도 불구  이재명 싫다 며 안 만나 ,Politics
 정권 반대투쟁  선동에  서울이 과녁  위협도 막나가는 김여정,Politics
이낙연 귀국   유인태  이재명 구속 고사 지내나   조응천  언론 클릭 장사 ,Politics
 왜 제네시스 아닌 벤츠 타셨나   질의에 대통령실      개최국 제공 방탄차량 특정구간서만 이용 ,Politics
정진석    김여정  서울 과녁  비난에     왜 항변하지 않나 ,Politics
 최강시사  장동혁  이태원 국조 예산안  처리 늦으면 조사기간도 줄어들 것 ,Politics
  김기현  거짓말 입에 달고 사는 김의겸 즉각 사퇴해야 ,Politics
유인태  유동규 중용한 사람 누군가 이재명   죄송하다  해야 ,Politics
 비명  조응천  최측근 구속 이재명에  입장 표명 해야       도 했어 ,Politics
조응천  이재명  정치적 책임에 유감 표명해야 사퇴 전제 아냐 ,Politics
청담동 술자리 첼리스트  남친 속이려 거짓말했다 ,Politics
김여정    천치바보   해먹을 땐 서울 과녁 아니었다 ,Politics
 청담동 술자리 의혹  첼리스트  다 거짓말이었다 전 남친 속이려 ,Politics
청담동 술자리는  거짓  김기현  김의겸 직격   생사람  잡는 일에만 골몰  의원직 사퇴하라 ,Politics
대선 경선 앞두고  이재명 자택  억    만원 현금  출처 의혹에 민주    악의적 주장 ,Politics
 정치쇼  장예찬  장경태 고발이  호  참여정부도 한나라당 의원 고소했다 ,Politics
 전문 김여정  윤석열 천치 국민은 왜 보고만 있나 ,Politics
이재명 자택  억대 현금  출처 의혹에    민주당  악의적 주장 ,Politics
김여정  문재인 땐 서울이 과녁 아니었다    윤 대통령엔  천치바보 ,Politics
 윤석열 인간 자체가 싫다 는 김여정  이번엔  윤석열 천치 바보  원색적 비난,Politics
이원욱        서 벤츠 사랑  대통령실  제네시스     탔다 ,Politics
 뉴스라이더  자신감 어디서   기자 예의 물었더니   박수현이 전한   반응은 ,Politics
  김종민  민주  이재명 방탄 땐 제  조국사태 올 수도 ,Politics
조응천  이재명 유감 표명해야            도 했다 ,Politics
 당권주자 다 모였네     새미래 에 모습 드러낸 김기현 안철수 나경원,Politics
 뉴스라이더  또 의혹 제기 또 반박   민주당    대통령실 적대적 대치,Politics
  김여정  문재인 때는 서울이 과녁 아냐 윤석열 천치 ,Politics
도 넘은 김여정 막말 비난 담화  윤석열 저 천치바보들 ,Politics
김여정  남남갈등 조장  국민은 윤석열 천치바보들 왜 보고만 있나 ,Politics
집권 여당  노정관계  시험대   답 정해진 정치파업 ,Politics
김종민  민주당  이재명 방탄정당 되면 국민신뢰 잃어 ,Politics
유승민 때린 조경태  배신자 프레임 왜 생겼는지 돌아봐야 ,Politics
김여정   땐 적어도 서울이 과녁 아니었다   엔  천치바보 ,Politics
  향해 막말 쏟아낸 김여정  천치바보 왜 보고만 있나 ,Politics
  구속 수사에 김용 민주당직 사퇴   사의 표명한 정진상은 구속적부심 후 판단,Politics
      한동훈 청담동 술자리 의혹  제기 김의겸에  거짓말 자판기 ,Politics
청담동 술자리 없었다 첼리스트  전 남친 속이려 거짓말 진술,Politics
 영상  우루과이전 보기 전에 꼭 알아야 할 사실   최초 도 많고  논란 도 많은 카타르 월드컵  정치왜그래  ,Politics
   체제 위협 두렵나 손흥민     정국 이어 태극기도 가렸다,Politics
김기현  민주당   거짓말쟁이 양치기 지도부 김의겸  즉각 징계해야 ,Politics
김여정  윤에 막말 비난  천치 바보를 왜 보고만 있나 ,Politics
 대장동 핵심인물  김만배   년 만에 출소   법률적 판단 떠나 죄송 ,Politics
배종찬    지지율 막는 세 가지  김건희 이상민      한판승부 ,Politics
빈 살만에 머스크까지  대통령  슈퍼리치  만나는 이유는 ,Politics
    제네시스보다 벤츠 좋아한다   대통령실 해명은,Politics
김여정    천치바보  땐 적어도 서울이 과녁은 아녔어 ,Politics
조경태  유승민 직격  자기 정치 너무 심해  배신자 프레임 왜 생겼겠나 ,Politics
 김여정  이틀만에 또 담화   정부에  천치바보  맹비난 종합 ,Politics
이재명  언론탄압  주장하자     예의없으니 인터뷰 커트   사건 꺼냈다,Politics
권성동  이재명 겨냥   그분 은 종합 범죄인이자 살아있는 형법 교과서 ,Politics
대통령실     서   현대차 아닌 벤츠 이용  사실 아냐 ,Politics
김종민  민주당  이재명 방탄정당 되면 국민신뢰 잃는다  한판승부 ,Politics
국민 절반  정진상 구속은 정치적 수사 이재명  검찰 조작  발언에 공감   데일리안 여론조사 ,Politics
국민 과반  이재명 사법리스크 있다  정권퇴진 집회 의원 참여엔  공감   데일리안 여론조사 ,Politics
도어스테핑에 슬리퍼  부적절            민영화엔  반대         데일리안 여론조사 ,Politics
  김여정  서울 과녁  언급하며 위협   대통령에는  천치바보  종합 ,Politics
김여정  윤석열 천치 바보들   문재인 땐 서울이 과녁 아니었다 ,Politics
케냐 영부인  한국 급속 발전 비결  묻자   김건희 여사  새마을 운동 ,Politics
김여정  문재인 땐 적어도 서울이 과녁은 아니었어  종합 ,Politics
김여정  윤석열 저 천치바보들이 만들어가는 위태로운 상황을 왜 보고만 있나 ,Politics
김여정    정부에 막말  천치바보들 왜 보고만 있나 ,Politics
김여정     천치바보    국민들 왜 보고만 있나  막말,Politics
김여정  윤 대통령에 막말 위협   저 천치바보 왜 두고보나   문재인이 앉아 해먹을 때는 서울은 과녁 아니었다 ,Politics
김기현  장경태  대국민 사기극 벼락출세에 제정신 잃어 ,Politics
 개월 만에 입 연 김여정   대통령에  천치바보  막말,Politics
 최장수  차석용   생건 회장 물러나 후임엔 이정애 부사장,Economic
이 총재    대 물가  변동성 커 대응 필요  베이비스텝 결정 이유 상보 ,Economic
이창용  과도한 한미금리 격차 바람직 않지만 국내요인 우선 ,Economic
한은 총재  최종금리      전망   금리인하 논의는 시기상조 ,Economic
화물연대 총파업 전국서 동시 출정식 첫날     참여,Economic
 연속 금리인상해       자금경색 우려에  베이비스텝  종합 ,Economic
고령화 쓰나미          년 국가채무비율      넘을 수도 ,Economic
레고랜드 자금경색에 금통위 선택은  베이비스텝 ,Economic
구조조정에 떠는 증권가   감원 칼바람 본격화,Economic
     국가채무비율 낮추려면 소득세 부가세 실효세율    씩 올려야 ,Economic
 배달원 못구하고  건강앱 먹통  확진자 급증에   방역  멘붕 ,Economic
  생건 차석용 부회장    년만에 퇴진  그룹 첫  사장 나왔다,Economic
고령화 가속   복지 재원  감당 안될수도  증세 필요하다 ,Economic
화물연대  만여명 결국 운전대 놨다 철강 시멘트 줄줄이 발 묶이나,Economic
 부릉  메쉬코리아  일부 주주 매각 반대에 법정관리 추진     일 결정 ,Economic
한은 총재  금리인하 논의 시기상조 최종금리           예상 ,Economic
정주영 열정 그대로    년 만에  포니 쿠페  되살린다,Economic
또 올렸지만 보폭 줄인 금리 자본유출   자금경색 사이 고육책,Economic
  화장품에 밀려난  설화수 후  광군제 매출   위권 밖으로,Economic
 내보험 찾아줌  고마워  지난해 보험금    조 주인 찾아갔다,Economic
 일문일답 원희룡  화물연대  민주당안 처리 요구하며    구성 불참 ,Economic
원희룡    를 통한 논의 거부한 것은 화물연대   업무개시명령 내릴 준비 됐다 ,Economic
         년 국가채무비율      부가세 소득세 올려야 ,Economic
 분기 임금 일자리     만개   증가폭 둔화 절반은   대 이상,Economic
 르포    개월 복구 미완했지만    년만 폭우에 안전 지켰다   정상화 속도 내는 포항제철소  ,Economic
미      의사록  금리인상 속도조절  최종 금리는 예상보다 더 높을 듯,Economic
 초동시각 물 탄 콘크리트 현장검사와 불신의 비용,Economic
고된 장사에 닳은 손가락  지문인식 안돼  고통,Economic
 분기 일자리     만개 돌파 늘어난   만개 중       대 이상,Economic
임금근로 일자리 사상 첫     만개 넘어   만개  절반은   대 이상,Economic
원희룡  누가  무슨 자격으로 막나       우회없다 ,Economic
신차 대기만  년인데 개소세 인하 연장 한다  안한다 ,Economic
연내 압연라인   개중   개 복구  포스코  담금질 ,Economic
공시가격 현실화 사실상 폐기 세금 얼마나 줄어드나 ,Economic
     후폭풍  본격화 고팍스 원리금 지급 추가 지연,Economic
 서학개미는 지금  나스닥 상승    하락 기대 팽팽  배 레버리지  풀베팅 ,Economic
워런 버핏    비야디 주식 또 매각 지분 축소,Economic
고팍스  결국 코인예치 서비스  고파이  출금 전면중단 사태,Economic
 현장   담배연기 없는 미래  꿈꾼다는  필립모리스    양산공장 가보니,Economic
 화물연대 파업 피해 이번엔 더 심각  산업계 비상대책 가동 종합 ,Economic
전성기 이끈 미켈레  구찌와 결별    년 특별한 여정 끝내 ,Economic
   파산에 고팍스 결국 고파이 출금 지연  주내 정상화할 것,Economic
이재용 회장  상무 시절 데뷔 무대       년만에 다시 찾나,Economic
  내부서도  중진국 함정 빠질수도 경제 정상궤도 되돌려야 ,Economic
 금리인상  증시 단기영향 제한적 자금시장 안정은 시간걸려 ,Economic
원희룡  화물연대  명분 없는 이기적 행동 운송개시 명령 발동 준비 착수 ,Economic
원희룡 장관  화물연대 총파업에  업무개시명령  등 강경 대응 예고,Economic
쏘카 보험 카드 등   개 규제 푼다 대형마트 의무휴업은 제외,Economic
화물연대 총파업 돌입 둔춘 주공 내일부터 공사중단 위기,Economic
  중공업  해군 고속정  척 수주,Economic
야당 반대로 종부세 못 내려 재산세 인하  플랜   가동,Economic
한은  베이비 스텝 도     조 가계빚엔  이자폭탄 ,Economic
정부  화물연대 파업  심각해지면 업무개시명령 발동 ,Economic
원희룡  화물연대 정당성 없다 운송개시명령 발동 준비 ,Economic
 최대 곡창지대  전쟁 길어지자 뉴욕증시 농기계  위 기업에 쏠린 눈,Economic
  중앙은행    일부터 시장안정 위해 사들였던 국채 매각,Economic
    러시아 원유 가격상한제 합의 실패 협상 난항,Economic
아모레퍼시픽  한한령 해제 수혜 받나   증권가  분기 반등 기대론  솔솔 ,Economic
한국은행  기준금리        인상      로 마무리,Economic
주식서 탈출 러시   자산시장 판도 변화,Economic
이창용  최종금리 금통위원 의견 제각각      대다수 ,Economic
한은 총재  금리인하 논의 시기상조 물가 목표수준 수렴해야 ,Economic
금감원장  금리인상  예상에 부합 자금쏠림 감독 강화 ,Economic
연이은 금리 인상  부메랑    돈 줄 마른 기업  고난의 행군,Economic
 태풍 매미 때도 안한 고로 중지를   포스코가 직접 밝힌  힌남노 그날 ,Economic
울산서도 화물연대 파업 출정식 현대차  탁송에 직원 투입,Economic
 현장연결  한은총재  금통위원 전원 일치로        인상 결정 ,Economic
 속보 이창용  부동산 관련      쏠림 현상 계속 금리 급등 과도 ,Economic
  생건  첫     로 분위기 쇄신 차석용 부회장  후진 위해 용퇴  종합 ,Economic
 속보  이창용  최종금리 전망 연     가 가장 많아 ,Economic
버크셔        주식 추가 매각 버핏은  조원 기부,Economic
  생활건강   년 이끈  차석용 매직  최장수     내려놓다,Economic
화물연대 파업에 제철소 철강재 출하 중단   포스코 현대제철  만  이상,Economic
내년 경제성장률   대 추락   공식화한 경기침체,Economic
한은  사상 첫  차례 금리 인상  베이비스텝  속도 줄였지만 이자 부담 ,Economic
대전 세종    에 승객 태운 자율주행 버스 달린다,Economic
 대형마트 새벽 배송  등 쟁점규제 쏙 빠진 공정위 규제개혁,Economic
서울시  반지하 지상층 이주 시  년간 월   만원 지원,Economic
이복현  기준금리 인상에  자금쏠림 감독 강화할 것 ,Economic
 숨만 쉬고 살아도 남는 게 없네    생활비 아껴주는 신용카드  눈길 ,Economic
     화학부문 인적분할 추진    기업가치 재부각 기회될 것 ,Economic
화물연대 파업에 철강 운송차질 현대제철  천톤 출하 못해,Economic
봇물 터진       대형사로 더 쏠렸다,Economic
한한령 해제 기대감에 관련주 줄줄이 급등   허와 실은 ,Economic
보험 카드 사은품 늘어난다 마트 새벽배송 허용은 보류,Economic
