titles,category
 경쟁사도 시민도  수해 복구  합심   정상화 속도 내는 포항제철소  ,Economic
가뭄 전쟁  식량위기 악화에   각국  유전자 변형 작물  허용 움직임,Economic
채권금리  금통위 이후 하락세 주식시장은  무덤덤 ,Economic
  카타르 월드컵 첫 경기 거리 응원 수혜주는  잠잠 ,Economic
카셰어링 영업구역 제한 풀린다  편도 이동 후 원하는 곳에 반납 ,Economic
정부  화물연대 집단운송거부  정당성 명분 없는 이기적 행동 ,Economic
  번째 기준금리 인상  한은 총재  물가 목표 수렴 확신할 때 금리 인하 논의 ,Economic
증권가 구조조정 칼바람   다올투자증권  정규직 희망퇴직,Economic
 르포 필립모리스  심장 을 가다  만년  등 위기  깰 비책은,Economic
백화점  사  크리스마스 장식  철통 보안  유지  마침내 모두 공개,Economic
 현장연결  정부  화물연대 운송거부 철회 촉구 담화문 발표,Economic
  전자 인사에 쏠리는 눈  변화보다 안정  이어질까,Economic
 단독   생건  영유아 식품사업 접는다     년 만에 분유 철수,Economic
  화물연대 파업에 정부가 합의안 파기 안전운임 대상 확대법 추진 ,Economic
기아차 근로자들  통상임금  차 소송도 승소,Economic
화물연대   개 지부 파업 출정식   거점 항만 등 물류대란 비상,Economic
 한은 베이비스텝엔 안도 부동산시장 반전은 어려워 ,Economic
다올   희망퇴직 단행 경영 상무급 임원들 사직서 제출,Economic
차량 직접 운전 탁송 야드 트랙터 도로 운행 등 비상수송대책,Economic
연말 여의도 칼바람 시작됐나 다올투자증권  정규직 희망퇴직 진행,Economic
  건설   장위자이 레디언트  분양 중도금 이자 후불제,Economic
정부  운송방해 행위  끝까지 추적 무관용 대응  화물연대 파업 담화문,Economic
 주식 초고수는 지금  한화   화학과 파트너쉽 고려아연 성장성 부각,Economic
기준금리 올랐는데 은행들 예적금 금리 인상  눈치게임 ,Economic
 블프 시즌  해외직구족 들썩,Economic
부산 오시리아   자율차 시범운행지구  됐다,Economic
 속보  이창용         금리인상 결정 금통위원 만장일치 ,Economic
 응원엔 치맥이지  치킨업계  월드컵  경기 앞두고 판매 총력전,Economic
 현장영상   한은  기준금리        인상    불확실성 여전 ,Economic
서민연료 등유 휘발유보다 비싸다  당     원대,Economic
   미국산 차 보조금지원 언급조차 안했다,Economic
차석용 부회장 용퇴     생건  그룹 첫 여성 사장,Economic
 정부     년 원전 비중     확정 시민단체 반발 예고,Economic
태우지 않는 담배  어떻게 만들어지나 필립모리스 양산공장 가보니  르포 ,Economic
 르포  포스코는 포기하지 않았다  수해현장 가보니 ,Economic
 종목속으로  메리츠     뭉치니 살았다,Economic
 팀장시각  화물연대 파업이 침체를 부추기는 이유,Economic
메쉬코리아  대출만기 늘려주면 정상화 가능 ,Economic
이정애    그룹 첫 여성 사장 차석용   생활건강 부회장  용퇴   종합 ,Economic
 지금은 드려도 내년엔 안돼요  비닐봉지 금지 첫날 곳곳 혼란,Economic
  이르면   일 지준율        인하 발표   금리축소 유동성 동시 해결,Economic
포스코  압연라인  곳 복구   곳도 곧 가동 ,Economic
삼성    테일러 부지 선정  년     나노  구축 본격화,Economic
원희룡  화물연대 총파업  심각할 경우  업무개시명령  발동 검토 ,Economic
정부  파업 미참여 노동자 방해 협박 시 끝까지 추적 엄벌 ,Economic
조제용 감기약 가격   원 최대   원   업계  아쉽다 ,Economic
기준금리        인상        인당 이자부담    만원 늘어난다,Economic
카바나  경영진 대량 주식 매수   바닥 신호   영상 ,Economic
서울시  반지하 이주 본격화 이주시 월   만원 지원,Economic
원희룡  화물연대에 운송개시명령 발동 준비 착수 ,Economic
 전문  한은  고물가에 기준금리 인상 지속    대 성장세 둔화 ,Economic
여의도 증권가 구조조정  칼바람     다올투자증권 희망퇴직 단행,Economic
올해 마지막 금통위 통방문 문구 어떻게 달라졌나,Economic
   첫 여성     탄생 화장품  후   조 매출 이끈 이정애,Economic
한은  성장률 낮아지나 금리인상 당분간 지속 ,Economic
아듀  구찌 알렉산더 미켈레  후임은 마티유   명품톡  ,Economic
대영포장 태림포장 등 제지주 동반 급등   일회용품 금지 수혜 부각,Economic
원희룡  운송개시명령 준비 착수 곧 국무회의 상정할 것 ,Economic
 문답 서울시 반지하 대책  전세로 옮겨도 월   만원 지원한다,Economic
서울시  반지하 가구 지상층 이주시  년간 월   만원 지원,Economic
명문대 인접해  대세권  누리는  빌리브 디 에이블 ,Economic
반지하서 이사하면  년간 월세   만원 준다 자격조건은 ,Economic
 크리스마스 한달 앞  백화점 연말 장식 경쟁   사  색 ,Economic
한은   연속 기준금리 인상 속도는 베이비스텝으로 줄여 종합 보 ,Economic
정부  화물연대 업무개시명령 발동 복귀 거부엔 법적조치 불사 ,Economic
금융당국  외화채권 발행 자제   자금조달 계획 보고  압박,Economic
정부  화물연대 총파업에  운송개시명령  강경대응 시사,Economic
글로벌    낸드 시장     위축   하이닉스 점유율 한 계단 밀려,Economic
 성장세 둔화 약화  언급 한은 금통위  금리인상 속도조절 시사,Economic
 좀 불안한데     예금   조원 빼내간 슈퍼리치들 왜,Economic
폭탄세일 안하면 안사고   무권리 점포 쏟아지고     글로벌 경기침체 공식화 ,Economic
경기침체에 고물가     대 성장률  내년 경기한파 온다,Economic
대기업 직원  명 중  명  현재 구조조정 진행중 ,Economic
자금 블랙홀 한전 이달 회사채 발행액 사상최대,Economic
이복현 금감원장  금리 인상에 따른 리스크 대비태세 갖춰야  주문,Economic
 혹한기 코앞인데  화물연대 총파업에 건설업계  초긴장 ,Economic
한은  베이비스텝 밟았지만  물가 잡을 때까지 금리 올릴 것 ,Economic
 내년 경제한파 온다  한은 내년 성장률       물가      전망,Economic
신당 곡식창고  제 성수동 꿈  익어간다,Economic
재고 쌓이고 생산 멈추고   산업계   월 악몽 재연될라 ,Economic
 클릭  종목  엔터 미디어  내년 키워드는 중국 리오프닝 일제히  비중확대  ,Economic
 르포     일간    만명 사투  침수피해 포항제철소 살렸다,Economic
 금리 속도 조절 에 반응한 코스피  추세적 상승은 힘들 것 ,Economic
 전자 피부 가 뭐지  올해   대 나노기술 첫번째 자리에,Economic
 현장  힌남노 침수 포항제철  내년  월 정상화 가능할 듯,Economic
이복현  금리인상 시장예상에 부합하나 리스크 대비해야 ,Economic
내년  경기 한파  온다 한국 경제   대 성장 그칠 듯,Economic
부산 오시리아 전북 익산 자율차 시범운행지구 신규 지정,Economic
 불량률   에 가깝다  안전하고 엄격한 공정 생산시설 자랑하는  한국필립모리스 양산공장 ,Economic
  중공업  해군 신형 고속정  척 수주  고속정 누적수주   척 돌파,Economic
 르포 분 단위로 제품 이상 유무 점검   비연소 담배  위 탈환 전초기지,Economic
 제철소 다시 지어라  비관 속 흘린 구슬땀 포스코    개월의 기적  이룰까,Economic
 르포  절망 속에 희망을 보았다   침수   일  복구에 전력 중인 포스코,Economic
고추건조기 핸드드라이어까지 총동원 포스코  압연공장   곳 연내 재가동 ,Economic
안심전환대출 요건 완화에도  냉랭  흥행 위해 영끌족도 품는다,Economic
 르포   비연소 담배 생산  허브    스마트공정 도입으로 균일 품일 유지 ,Economic
건설사 현금확보 대우 리조트 팔고  롯데 사옥 담보 잡히고,Economic
 경제불황 이제 시작   내년 경제성장률      전망 ,Economic
철도노조 준법투쟁 시작 운행 지연 시작,Economic
 최종은        더 오른다   베이비 스텝 에도 방심 말라는 전문가들,Economic
금통위  성장률 낮아져도 물가 오름세 지속 당분간 금리인상 ,Economic
 비트코인 지금   금리인상 속도조절론에 소폭 상승 투심은  꽁꽁 ,Economic
서민연료 등유  당  천   원대까지 휘발유와 가격역전도,Economic
부산 익산서도 승객 태운 자율주행 버스 달린다,Economic
  년간     자리지킨   생활건강 차석용 용퇴,Economic
 르포 아이코스 일루마  테리아  생산 공장 가보니  사람 대신 로봇 담배향만 ,Economic
 현장   삼성  랩은 가장 특별하다  스타트업이 만족하는 이유,Economic
 르포     만  흙탕물로 찼던 포항제철소에 다시 쇳물 열기,Economic
 든든한 삼성 파트너 덕에 매출   배 이상 늘었죠 ,Economic
이재용의 스타트업 동행 삼성   랩 아웃사이드  현장 가보니,Economic
매일  만    명 투입 포항제철소  복구 마무리 다 왔다 ,Economic
 르포   담배연기 없는 미래 구현  필립모리스 양산공장에 가다,Economic
화물연대  의왕   서 총파업 출정식  안전운임 일몰제 폐지해야 ,Economic
 배수로 완전 침수에도 인명 사고 전무   정상화 속도 내는 포항제철소  ,Economic
카뱅 출신 국회의원이 바라본 카카오 거버넌스는 ,Economic
